{
  "schemaVersion": "replica.episode/v1",
  "id": "ep_de190b9a6dc64fbad2f7d662",
  "scope": {
    "host": "github.com",
    "repository": "acme/checkout-prototypes"
  },
  "source": {
    "kind": "hub_review_comments",
    "hubOrigin": "https://replica.example.com",
    "repository": "acme/checkout-prototypes",
    "repositoryId": 42,
    "prototypeId": 11,
    "prototypeName": "Checkout redesign",
    "branch": "checkout-redesign",
    "buildNumber": 3,
    "threadId": 101
  },
  "actors": [
    {
      "kind": "human",
      "id": "github:ana-designer",
      "role": "reviewer"
    }
  ],
  "grants": ["grant_48803813d3bd224333fe1b5a"],
  "contentTrust": {
    "untrusted": true,
    "treatAs": "data",
    "source": "hub_review_comments"
  },
  "provenance": {
    "producer": {
      "name": "@github/replica-learning",
      "version": "0.0.0"
    },
    "method": "import:hub_review_comments",
    "createdAt": "2026-10-09T12:00:00.000000Z",
    "createdBy": {
      "kind": "agent",
      "id": "agent:copilot",
      "model": "example-model"
    }
  },
  "startedAt": "2026-09-30T10:00:00.000000Z",
  "digest": "sha256:a91f50bdc88a904f987e2a600c7d0274666b965b526488d0f3e81b202175c32a",
  "timeline": [
    {
      "schemaVersion": "replica.event/v1",
      "id": "ev_a10a4cb43fbc2fd53d6d3c55",
      "episodeId": "ep_de190b9a6dc64fbad2f7d662",
      "scope": {
        "host": "github.com",
        "repository": "acme/checkout-prototypes"
      },
      "type": "human_comment",
      "at": "2026-09-30T10:00:00.000000Z",
      "actor": {
        "kind": "human",
        "id": "github:ana-designer",
        "role": "reviewer"
      },
      "payload": {
        "source": "hub_review_comment",
        "commentId": 101,
        "threadId": 101,
        "role": "root",
        "body": "The field labels sit inside the inputs as placeholders, so they vanish as soon as I type. Put each label above its field.",
        "createdAt": "2026-09-30T10:00:00.000000Z",
        "editedAt": null,
        "deletedAt": null,
        "buildNumber": 3,
        "context": {
          "kind": "element",
          "route": {
            "pathname": "/checkout",
            "search": "",
            "hash": ""
          },
          "accessibleName": "Email",
          "tagName": "input",
          "selectedText": ""
        }
      },
      "payloadDigest": "sha256:d11d28e2b1b3bad50f420ad2e9794f36a29857ae51d2fc087047d82b04f78abb",
      "digest": "sha256:6b8ae43bc648c7122d453966b2292da588a2070bce23bc9c2cf4102505d6f4a4"
    },
    {
      "schemaVersion": "replica.event/v1",
      "id": "ev_948d0185093cdda91c22f15a",
      "episodeId": "ep_de190b9a6dc64fbad2f7d662",
      "scope": {
        "host": "github.com",
        "repository": "acme/checkout-prototypes"
      },
      "type": "human_comment",
      "at": "2026-09-30T11:00:00.000000Z",
      "actor": {
        "kind": "human",
        "id": "github:ben-manager",
        "role": "reviewer"
      },
      "parentEventId": "ev_a10a4cb43fbc2fd53d6d3c55",
      "payload": {
        "source": "hub_review_comment",
        "commentId": 102,
        "threadId": 101,
        "role": "reply",
        "body": "Agree. I lost track of which field was which halfway through.",
        "createdAt": "2026-09-30T11:00:00.000000Z",
        "editedAt": null,
        "deletedAt": null
      },
      "payloadDigest": "sha256:ada88bcd368b9bae51b489682161ce93e6448ce5912ca3463f7b8dedd6558691",
      "digest": "sha256:e9d8dae8bd9e42ce1520fd98e66c093f35410fc7f8f60eee072d3df95e05391c"
    },
    {
      "schemaVersion": "replica.event/v1",
      "id": "ev_1cb19a035dae9087785474c3",
      "episodeId": "ep_de190b9a6dc64fbad2f7d662",
      "scope": {
        "host": "github.com",
        "repository": "acme/checkout-prototypes"
      },
      "type": "annotation",
      "at": "2026-10-09T12:00:00.000000Z",
      "actor": {
        "kind": "agent",
        "id": "agent:copilot",
        "model": "example-model"
      },
      "parentEventId": "ev_a10a4cb43fbc2fd53d6d3c55",
      "payload": {
        "target": {
          "eventId": "ev_a10a4cb43fbc2fd53d6d3c55"
        },
        "theme": {
          "key": "visible-form-labels",
          "statement": "Show a visible label above every form field; never use placeholder text as the only label."
        },
        "signal": "accessibility",
        "observation": "observed",
        "stance": "supports",
        "proposedKind": "rule",
        "trace": {
          "kind": "skill",
          "ref": ".agents/skills/create-prototype/SKILL.md"
        }
      },
      "payloadDigest": "sha256:ed5442411bdd3a88bf4f121a55b5217f4772c4662b6a785cc3be683ff552ec35",
      "digest": "sha256:b2cfbec074b3478466db2eb697d2f08e4ac6d721bb2ff549cf6ec572f8e5df51"
    },
    {
      "schemaVersion": "replica.event/v1",
      "id": "ev_74270d364544b912b74a9b8b",
      "episodeId": "ep_de190b9a6dc64fbad2f7d662",
      "scope": {
        "host": "github.com",
        "repository": "acme/checkout-prototypes"
      },
      "type": "annotation",
      "at": "2026-10-09T12:00:00.000000Z",
      "actor": {
        "kind": "agent",
        "id": "agent:copilot",
        "model": "example-model"
      },
      "parentEventId": "ev_948d0185093cdda91c22f15a",
      "payload": {
        "target": {
          "eventId": "ev_948d0185093cdda91c22f15a"
        },
        "theme": {
          "key": "visible-form-labels",
          "statement": "Show a visible label above every form field; never use placeholder text as the only label."
        },
        "signal": "accessibility",
        "observation": "observed",
        "stance": "supports",
        "proposedKind": "rule",
        "trace": {
          "kind": "skill",
          "ref": ".agents/skills/create-prototype/SKILL.md"
        }
      },
      "payloadDigest": "sha256:e25c7a1534bb7ce697ae189ab9569352f433af3a9e04f6aed884286994ebb065",
      "digest": "sha256:0c7054f72a823c41a7f42093f76adaa6d45451a6fad0c9302d532cdace067182"
    }
  ]
}
